{
  "schema_version": "0.1.0",
  "kind": "product-check-results",
  "run": {
    "run_id": "PCR-20261014T100000Z-D1738E",
    "status": "ABORTED",
    "started_at": "2026-10-14T10:00:00.000Z",
    "finished_at": "2026-10-14T10:00:00.000Z",
    "duration_ms": 0,
    "tool": "product-check",
    "tool_version": "0.2.0",
    "node_version": "normalized",
    "methodology": {
      "name": "CT3",
      "label": "Customer × Technology × Trust",
      "relationship": "inspired",
      "reference_version": "CLEAR CT v3.1 (unpublished; principles only)"
    },
    "mode_requested": "APPLICATION",
    "mode_effective": null,
    "tier": "CT-T1",
    "tiers_applied": [
      "CT-T0",
      "CT-T1"
    ],
    "target_revision": {
      "repository": null,
      "application": {
        "origin": "https://vibenotes-demo.example",
        "observed_at": null,
        "final_status": null
      }
    },
    "phases": [
      {
        "phase": "SCAN",
        "status": "FAILED",
        "notes": [
          "no source inspected",
          "no application observed"
        ]
      },
      {
        "phase": "TEST",
        "status": "SKIPPED",
        "notes": [
          "no application checks",
          "0 test results file(s) imported (0 cases); Product Check executes no repository code"
        ]
      },
      {
        "phase": "VALIDATE",
        "status": "SKIPPED",
        "notes": [
          "51 controls evaluated against CT-T1",
          "0 open finding(s)"
        ]
      },
      {
        "phase": "BLUEPRINT",
        "status": "SKIPPED",
        "notes": [
          "0 remediation(s), 0 work packet(s)"
        ]
      },
      {
        "phase": "DASHBOARD",
        "status": "SKIPPED",
        "notes": [
          "Rendered on demand from this file (`product-check dashboard`)."
        ]
      },
      {
        "phase": "REMEDIATE",
        "status": "SKIPPED",
        "notes": [
          "Product Check proposes changes and work packets; it never modifies code."
        ]
      },
      {
        "phase": "RETEST",
        "status": "SKIPPED",
        "notes": [
          "no baseline given"
        ]
      }
    ],
    "errors": [
      "Aborted before inspection: APPLICATION mode needs authorization to request https://vibenotes-demo.example."
    ],
    "network": {
      "used": false,
      "requests": 0,
      "origins": []
    },
    "baseline": null,
    "demo": false
  },
  "contract": {
    "schema_version": "0.1.0",
    "kind": "scan-contract",
    "contract_id": "local-scan",
    "labels": {
      "demo": false
    },
    "target": {
      "name": "vibenotes-demo.example",
      "purpose": null,
      "repository": null,
      "application": {
        "url": "https://vibenotes-demo.example"
      }
    },
    "mode": "APPLICATION",
    "lifecycle_stage": "ALPHA",
    "tiers": null,
    "product": {
      "has_user_accounts": null,
      "multi_tenant": null,
      "handles_personal_data": null,
      "uses_ai": null,
      "payments": null
    },
    "personas": [],
    "critical_journeys": [],
    "authorization": {
      "authorized_actions": [
        "read-local-source",
        "import-artifacts"
      ],
      "prohibited_actions": [
        "production-write",
        "destructive-test",
        "real-outreach",
        "payment-flow",
        "active-security-scan",
        "credentialed-access",
        "personal-data-extraction",
        "execute-repository-code",
        "paid-external-call"
      ],
      "scope": {
        "origins": [
          "https://vibenotes-demo.example"
        ]
      },
      "attestation": null
    },
    "constraints": {
      "max_requests": 12,
      "request_timeout_ms": 10000,
      "max_files": 5000
    },
    "imports": {
      "test_results": [],
      "npm_audit": null,
      "har": null,
      "observations": null,
      "spec_check": null,
      "impact_check": null,
      "outcome_check": null,
      "architecture_check": null,
      "openslo": [],
      "alert_rules": [],
      "service_graph": null
    },
    "control_mappings": [],
    "risk_acceptances": [],
    "scoring": {
      "min_coverage": 0.5,
      "pillar_threshold": 70
    },
    "release": {
      "approver": null
    }
  },
  "pop_coverage": {
    "schema_version": "0.1.0",
    "kind": "pop-coverage",
    "pops": [
      {
        "access": "none",
        "authorization": "not-required",
        "observed_at": null,
        "evidence_ids": [],
        "id": "repository",
        "category": "source-build",
        "name": "Source repository",
        "status": "BLOCKED",
        "relevant": true,
        "scope": null,
        "provenance": "none",
        "limitations": [
          "No repository was provided (--repo)."
        ]
      },
      {
        "access": "none",
        "authorization": "not-required",
        "observed_at": null,
        "evidence_ids": [],
        "id": "dependency-manifests",
        "category": "source-build",
        "name": "Dependency manifests",
        "status": "BLOCKED",
        "relevant": true,
        "scope": null,
        "provenance": "none",
        "limitations": [
          "No repository was provided (--repo)."
        ]
      },
      {
        "access": "none",
        "authorization": "not-required",
        "observed_at": null,
        "evidence_ids": [],
        "id": "automated-tests",
        "category": "source-build",
        "name": "Automated test sources",
        "status": "BLOCKED",
        "relevant": true,
        "scope": null,
        "provenance": "none",
        "limitations": [
          "No repository was provided (--repo)."
        ]
      },
      {
        "access": "none",
        "authorization": "not-required",
        "observed_at": null,
        "evidence_ids": [],
        "id": "test-results",
        "category": "source-build",
        "name": "Executed test results",
        "status": "BLOCKED",
        "relevant": true,
        "scope": null,
        "provenance": "none",
        "limitations": [
          "No executed test results were imported (Product Check never runs repository code)."
        ]
      },
      {
        "access": "none",
        "authorization": "not-required",
        "observed_at": null,
        "evidence_ids": [],
        "id": "ci-cd",
        "category": "source-build",
        "name": "CI/CD configuration",
        "status": "BLOCKED",
        "relevant": true,
        "scope": null,
        "provenance": "none",
        "limitations": [
          "No repository was provided (--repo)."
        ]
      },
      {
        "access": "none",
        "authorization": "not-required",
        "observed_at": null,
        "evidence_ids": [],
        "id": "iac",
        "category": "operations",
        "name": "Hosting / infrastructure configuration",
        "status": "BLOCKED",
        "relevant": true,
        "scope": null,
        "provenance": "none",
        "limitations": [
          "No repository was provided (--repo)."
        ]
      },
      {
        "access": "none",
        "authorization": "not-required",
        "observed_at": null,
        "evidence_ids": [],
        "id": "database-schema",
        "category": "data",
        "name": "Database schema and migrations",
        "status": "BLOCKED",
        "relevant": true,
        "scope": null,
        "provenance": "none",
        "limitations": [
          "No repository was provided (--repo)."
        ]
      },
      {
        "access": "none",
        "authorization": "not-authorized",
        "observed_at": null,
        "evidence_ids": [],
        "id": "deployed-web",
        "category": "experience",
        "name": "Deployed web application",
        "status": "BLOCKED",
        "relevant": true,
        "scope": "https://vibenotes-demo.example",
        "provenance": "none",
        "limitations": [
          "Run aborted: APPLICATION mode needs authorization to request https://vibenotes-demo.example."
        ]
      },
      {
        "access": "none",
        "authorization": "not-required",
        "observed_at": null,
        "evidence_ids": [],
        "id": "api-definition",
        "category": "interfaces",
        "name": "API definition (OpenAPI/GraphQL)",
        "status": "BLOCKED",
        "relevant": true,
        "scope": null,
        "provenance": "none",
        "limitations": [
          "No repository was provided (--repo)."
        ]
      },
      {
        "access": "none",
        "authorization": "not-required",
        "observed_at": null,
        "evidence_ids": [],
        "id": "observability",
        "category": "operations",
        "name": "Production telemetry (logs, metrics, traces, alerts)",
        "status": "NOT_APPLICABLE",
        "relevant": false,
        "scope": null,
        "provenance": "none",
        "limitations": [
          "Not required before launch tiers (CT-T4+)."
        ]
      },
      {
        "access": "none",
        "authorization": "not-required",
        "observed_at": null,
        "evidence_ids": [],
        "id": "ai-integration",
        "category": "ai",
        "name": "AI integration (SDKs, prompts, evals)",
        "status": "BLOCKED",
        "relevant": true,
        "scope": null,
        "provenance": "none",
        "limitations": [
          "AI use unknown without source; declare product.uses_ai."
        ]
      },
      {
        "access": "none",
        "authorization": "not-required",
        "observed_at": null,
        "evidence_ids": [],
        "id": "documentation",
        "category": "governance",
        "name": "Documentation and specifications",
        "status": "BLOCKED",
        "relevant": true,
        "scope": null,
        "provenance": "none",
        "limitations": [
          "No repository was provided (--repo)."
        ]
      },
      {
        "access": "none",
        "authorization": "not-required",
        "observed_at": null,
        "evidence_ids": [],